Task Name,Dataset Count,Common Datasets (Top 10),Benchmarks,SOTA Metrics,Subtasks,Categories,Description (First 200 chars)
Conversational Response Generation,10,"diaforge-utc-r-0725; MIBot - Motivational Interviewing for Smoking Cessation Dataset, based on MIBOT Version 6.3A; DuLeMon; ChatGPT Role-Play Dataset (CRD); CPED; BeNYfits; LLMafia; Arabic-ToD; Alpaca Data Galician; CAsT-snippets",N/A,N/A,Personalized and Emotional Conversation,Natural Language Processing,"Given an input conversation, generate a natural-looking text reply to the last conversation element.    Image credit: [DIALOGPT : Large-Scale Generative Pre-training for Conversational Response Genera..."
Large Language Model,10,HiXSTest; diaforge-utc-r-0725; VMD; MedConceptsQA; IFEval; TriviaHG; GlotSparse; Human Simulacra; RPEval; SGXSTest,N/A,N/A,Knowledge Graphs; RAG; AI Agent,Methodology; Knowledge Base; Natural Language Processing,N/A
Explanation Generation,9,ExPUNations; E-KAR; e-SNLI-VE; SuMe; E-ReDial; WHOOPS!; CLEVR-X; SpanEX; VCR,VQA-X; e-SNLI-VE; WHOOPS!; CLEVR-X; VCR,M; RL; C; B4; Accuracy; Human Explanation Rating; Acc; Human (%),N/A,Natural Language Processing,N/A
Few-Shot Audio Classification,9,Common Voice; Watkins Marine Mammal Sounds; NSynth; CREMA-D; Speech Accent Archive; ESC-50; VoxCeleb1; BirdClef 2020  (Pruned); FSDKaggle2018,N/A,N/A,N/A,N/A,N/A
KG-to-Text Generation,9,AGENDA; WikiGraphs; GenWiki; XAlign; EventNarrative; WebQuestions; PathQuestion; ENT-DESC; WebNLG,AGENDA; WikiGraphs; WebNLG (All); WebNLG (Unseen); EventNarrative; WebNLG 2.0 (Unconstrained); WebQuestions; WebNLG (Seen); PathQuestion; ENT-DESC,ChrF++; BLEU; rBLEU(w/title)(Test); rBLEU(w/title)(Valid); rBLEU (Valid); FactSpotter; rBLEU (Test); Test perplexity; chrF++; METEOR,N/A,Natural Language Processing,Knowledge-graph-to-text (KG-to-text) generation aims to generate high-quality texts which are consistent with input graphs.    Description from: [JointGT: Graph-Text Joint Representation Learning for ...
Person Search,9,CUHK-QA; Market1501-Attributes; PRW; DukeMTMC-attribute; ICFG-PEDES; P-DESTRE; XKCDColors; MovieNet; CUHK-SYSU,CUHK-SYSU; PRW,mAP; MAP; Top-1,N/A,Computer Vision,"**Person Search** is a task which aims at matching a specific person among a great number of whole scene images.   <span class=""description-source"">Source: [Re-ID Driven Localization Refinement for Pe..."
Anomaly Classification,9,VisA-AC; MVTec-AC; GoodsAD; ELPV; VisA; Lusitano Fabric Defect Detection Dataset; Hawk Annotation Dataset; MVTecAD; edeniss2020,VisA-AC; MVTec-AC; GoodsAD; VisA; MVTecAD,Detection AUROC; Accuracy(%); AUPR; Accuracy (% ); AUROC,Anomaly Severity Classification (Anomaly vs. Defect),Computer Vision,"Anomaly Classification is the task of identifying and categorizing different types of anomalies in visual data, rather than simply detecting whether an input is normal or anomalous. Unlike anomaly det..."
Cross-Lingual NER,9,WikiANN; MSRA CN NER; MasakhaNER; WikiNEuRal; UNER v1; CoNLL 2003; Europeana Newspapers; CoNLL; XGLUE,N/A,N/A,N/A,N/A,N/A
Chart Question Answering,9,ChartQA; MMVP; DVQA; RealCQA; LEAF-QA; Vega-Lite Chart Collection; SBS Figures; FigureQA; PlotQA,ChartQA; RealCQA; PlotQA,1:1 Accuracy,N/A,Computer Code,Question Answering task on charts images
Abusive Language,9,PointDenoisingBenchmark; The ComMA Dataset v0.2; DKhate; Hate Speech; Cards Against Humanity; CoRAL dataset; TalkDown; Hate Speech and Offensive Language; Torque,N/A,N/A,N/A,Natural Language Processing,N/A
Dialogue Understanding,9,WDC-Dialogue; Harry Potter Dialogue Dataset; MutualFriends; Molweni; Emotional Dialogue Acts; Doc2Dial; ProsocialDialog; DiaASQ; The Mafia Dataset,N/A,N/A,Dialogue Safety Prediction; Spoken Language Understanding,Natural Language Processing,N/A
Arithmetic Reasoning,9,SMART-101; MathMC; Game of 24; TIME; MGSM; GSM8K; PolyMATH; GSM-Plus; MathToF,MathMC; MultiArith; Game of 24; GSM8K; MathToF,Accuracy; Parameters (Billion); Success,N/A,Reasoning,N/A
Multiple Choice Question Answering (MCQA),9,M3KE; BIG-bench; MedMCQA; LMCQA; FrenchMedMCQA; SecQA; MML; IndicGLUE; SF20K,N/A,N/A,N/A,N/A,N/A
General Classification,8,Adult; iris; Kvasir-Capsule; Fashion-MNIST; CVR; MNIST; Wine; Hyper-Kvasir Dataset,iris; XOR; Fashion-MNIST; Mice Protein; CVR; Shrutime; ISOLET; CVE to CWE mapping; MNIST; Wine,Test error; Accuracy; 5 fold cross validation,N/A,Methodology,Algorithms trying to solve the general task of classification.
Few-Shot Learning - 4 shots,8,Food-101; FGVC-Aircraft; Oxford 102 Flower; Stanford Cars; SUN397; EuroSAT; UCF101; DTD,N/A,N/A,N/A,N/A,N/A
Temporal Tagging,8,Catalan TimeBank 1.0; HengamCorpus; KRAUTS; TimeBankPT; Basque TimeBank; Spanish TimeBank 1.0; French Timebank; TempEval-3,N/A,N/A,N/A,N/A,N/A
Formation Energy,8,MD17; OQMD v1.2; Matbench; QM9; Materials Project; WBM; JARVIS-DFT; OQM9HK,OQMD v1.2; Salicylic Acid; GeTe; QM9; Materials Project; LiPS20; JARVIS-DFT; Ethanol; OQM9HK; Aspirin,MAE,N/A,Miscellaneous,"On the QM9 dataset the numbers reported in the table are the mean absolute error in eV on the target variable U0 divided by U0's chemical accuracy, which is equal to 0.043."
Gloss-free Sign Language Translation,8,CSL-News; RWTH-PHOENIX-Weather 2014 T; CSL-Daily; OpenASL; How2Sign; PHOENIX14T; DailyMoth-70h; Mediapi-RGB,N/A,N/A,N/A,N/A,N/A
ECG Classification,8,PTB Diagnostic ECG Database; CODE-15%; UCR Time Series Classification Archive; PhysioNet Challenge 2021; MIMIC-IV-ECG; PhysioNet Challenge 2020; PTB-XL; ECG Heartbeat Categorization Dataset,UCR Time Series Classification Archive; PhysioNet Challenge 2021; PhysioNet Challenge 2020; PTB-XL; Electrocardiography (ECG) on Telehealth Network of Minas Gerais (TNMG),PhysioNet/CinC Challenge Score(stratified10-fold); F1 (RBBB); Accuracy (Test); PhysioNet Challenge score (test data); F1 (LBBB); F1 (AF); F1 (SB); PhysioNet Challenge score 2020 (validation data); F1(stratified10-fold); F1 (ST),Photoplethysmography (PPG),Medical,N/A
Dialogue Evaluation,8,CPsyCounE; diaforge-utc-r-0725; Reddit; FaithDial; USR-TopicalChat; SaGA; Reddit Engagement Dataset; USR-PersonaChat,USR-TopicalChat; USR-PersonaChat,Spearman Correlation; Pearson Correlation,N/A,Natural Language Processing,N/A
Chinese Reading Comprehension,8,Belebele; CMRC 2018; CJRC; DRCD; DMQA; CMRC; RoadTracer; ReCO,N/A,N/A,N/A,N/A,N/A
Heterogeneous Node Classification,8,IMDB (Heterogeneous Node Classification); OAG-L1-Field; ACM (Heterogeneous Node Classification); SupplyGraph; Freebase (Heterogeneous Node Classification); DBLP (Heterogeneous Node Classification); DBLP; OAG-Venue,N/A,N/A,N/A,N/A,N/A
Summarization,8,Multi-News; XSum; BillSum; CNN/Daily Mail; MLSUM; SAMSum; BigPatent; MuLD,ccdv/arxiv-summarization; scientific_papers; XSum; SAMSum; BillSum; big_patent; launch/gov_report; bazzhangz/sumdataset; kmfoda/booksum; SAMSum Corpus: A Human-annotated Dialogue Dataset for Abstractive Summarization,BLEU-1; METEOR; Rouge-L; BLEU-4,Query-focused Summarization; Unsupervised Extractive Summarization,Natural Language Processing,Summarization is the task of producing a shorter version of one or several documents that preserves most of the input's meaning.
Translation deu-eng,8,WMT 2015; WMT 2014; Tatoeba; Multi30K; FLoRes-101; WMT 2018; FLoRes-200; WMT 2016,N/A,N/A,N/A,N/A,N/A
Translation eng-deu,8,WMT 2015; WMT 2014; Tatoeba; Multi30K; FLoRes-101; WMT 2018; FLoRes-200; WMT 2016,N/A,N/A,N/A,N/A,N/A
Keyword Spotting,8,EmoSpeech; FKD; VoxForge; Auto-KWS; Speech Commands; TAU Urban Acoustic Scenes 2019; Google Speech Commands - Musan; PodcastFillers,Google Speech Commands (v2); FKD; VoxForge; QUESST; TAU Urban Acoustic Scenes 2019; TensorFlow; Google Speech Commands V2 12; Google Speech Commands; hey Siri; Google Speech Commands V2 35,Accuracy (10-fold); TFMA; Cnxe; Google Speech Commands V2 35; % Test Accuracy; PMUi; SSF; Google Speech Command-Musan; Google Speech Commands V1 12; Google Speech Commands V1 2,Small-Footprint Keyword Spotting; Visual Keyword Spotting,Speech; Computer Vision,"In speech processing, keyword spotting deals with the identification of keywords in utterances.    <span style=""color:grey; opacity: 0.6"">( Image credit: [Simon Grest](https://github.com/simongrest/ka..."
Sentence Embedding,8,UR-FUNNY; French CASS dataset; COSTRA 1.0; OPUS; Tatoeba; Video2GIF; Claim Matching Robustness; Opusparcus,N/A,N/A,N/A,N/A,N/A
Causal Inference,8,ParaBank; ICLR Database; NAIST COVID; Jobs; ChatGPT Advice Responses; NTPairs; IHDP; ReCO,Jobs; IDHP; IHDP,Average Treatment Effect Error; Average Treatment Effect on the Treated Error,Counterfactual Inference; Heterogeneous Treatment Effect Estimation; IHDP-CATE,Miscellaneous; Knowledge Base,"Causal inference is the task of drawing a conclusion about a causal connection based on the conditions of the occurrence of an effect.    <span style=""color:grey; opacity: 0.6"">( Image credit: [Recove..."
Stance Classification,8,DAST; HpVaxFrames; VaccineFrames; RuStance; VaccineLies; MMVax-Stance; CoVaxFrames; CoVaxLies v2,N/A,N/A,N/A,N/A,N/A
Story Generation,8,WritingPrompts; MoviePlotEvents; TVRecap; HANNA; Scifi TV Shows; Creative Writing; Visual Writing Prompts; Votranh DREAM_LOG,WritingPrompts; TVMegaSite test; Fandom test; Fandom dev; TVMegaSite dev,ROUGE-1; BLEU; ROUGE-2; Distinct-4; BLEU-2; BLEU-1; ROUGE-L; Perplexity,Visual Storytelling,Natural Language Processing,"Story generation is the task of automatically generating a coherent narrative, often from a set of premises or a brief summary."
Code Classification,8,TACO-BAAI; PyTorrent; FixEval; xCodeEval; CodeSCAN; Spectre-v1; ISAdetect dataset; A Software Maintainability Dataset,N/A,N/A,N/A,Computer Code,N/A
Code Summarization,8,Java scripts; CoSQA+; notebookcdg; DeepCom-Java; PyTorrent; MCoNaLa; ParallelCorpus-Python; CodeXGLUE,N/A,N/A,N/A,N/A,N/A
Multilingual NLP,8,Belebele; MAKED; M2QA; GLARE; Duolingo STAPLE Shared Task; English-Pashto Language Dataset (EPLD); HumSet; mBBC dataset,N/A,N/A,N/A,Natural Language Processing,N/A
Response Generation,8,Comet; KETOD; ComFact; ArgSciChat; ProsocialDialog; SIMMC2.0; MMConv; LLMafia,MMConv; ArgSciChat; SIMMC2.0,BLEU; Mover; Message-F1; Inform; Comb.; BScore; Success,N/A,Natural Language Processing,A task where an agent should play the $DE$ role and generate a text to respond to a $P$ message.
Multimodal Sentiment Analysis,7,MuSe-CaR; CH-SIMS; B-T4SA; Multimodal Opinionlevel Sentiment Intensity; CMU-MOSEI; CMU-MOSI; SemEval-2020 Task-8,N/A,N/A,N/A,N/A,N/A
Text Style Transfer,7,StyleGallery; Touchdown Dataset; StylePTB; XFORMAL; TextSeg; TextBox 2.0; Yelp,Yelp Review Dataset (Large); Yelp Review Dataset (Small),"BLEU; G-Score (BLEU, Accuracy)",Semi-Supervised Formality Style Transfer; Word Attribute Transfer; Formality Style Transfer,Natural Language Processing,Text Style Transfer is the task of controlling certain attributes of generated text. The state-of-the-art methods can be categorized into two main types which are used on parallel and non-parallel dat...
imbalanced classification,7,WikiChurches; Imbalanced-MiniKinetics200; Kinetics; Can you predict product backorder?; kaggle stroke Prediction competition; CI-MNIST; Industrial Benchmark Dataset for Customer Escalation Prediction,N/A,N/A,N/A,Miscellaneous,learning classifier from class-imbalanced data
Bayesian Inference,7,WebKB; UCLA Aerial Event Dataset; CIFAR-100; Blackbird; Summaries of genetic variation; ExBAN; State Traversal Observation Tokens,cifar100,Expected Calibration Error; Accuracy,Probabilistic Programming,Methodology,Bayesian Inference is a methodology that employs Bayes Rule to estimate parameters (and their full posterior).
Sequence-to-sequence Language Modeling,7,XSum; BillSum; CNN/Daily Mail; Reddit; Itihasa; ViHOS; WMT 2016,N/A,N/A,N/A,N/A,N/A
News Recommendation,7,V-MIND; xMIND; Reddit; Reddit Ideological and Extreme Bias Dataset; MIND; Reddit Ideology Database; Ranking social media news feed,N/A,N/A,N/A,N/A,N/A
Tabular Data Generation,7,Thyroid; Diabetes; SICK; Travel; California Housing Prices; HELOC; Adult Census Income,Diabetes; SICK; Travel; California Housing Prices; HELOC; Adult Census Income,Parameters(M); RF Mean Squared Error; DT Mean Squared Error; RF Accuracy; DT Accuracy; LR Mean Squared Error; LR Accuracy,N/A,Miscellaneous,Generation of the tabular data using generative models
Source Code Summarization,7,Java scripts; CodeSearchNet; DeepCom-Java; StaQC; ParallelCorpus-Python; Summarizing Source Code using a Neural Attention Model; CoDesc,Java scripts; CodeSearchNet; Summarizing Source Code using a Neural Attention Model - C#; DeepCom-Java; CodeSearchNet - Python; ParallelCorpus-Python; Summarizing Source Code using a Neural Attention Model - SQL; Summarizing Source Code using a Neural Attention Model - Python; CoDesc,F1; METEOR; Smoothed BLEU-4; BLEU-4,Method name prediction,Computer Code; Natural Language Processing,"**Code Summarization** is a task that tries to comprehend code and automatically generate descriptions directly from the source code.      <span class=""description-source"">Source: [Improving Automatic..."
Scientific Document Summarization,7,SemOpenAlex; ScisummNet; FacetSum; CL-SciSumm; TalkSumm; MS^2; unarXive,CL-SciSumm,ROUGE-2,Lay Summarization,Natural Language Processing,N/A
Malware Classification,7,IoT-23; Malimg; BODMAS; AutoRobust; EMBER; MOTIF; Microsoft Malware Classification Challenge,Microsoft Malware Classification Challenge; Malimg Dataset; MaleVis,Accuracy (10-fold); F1 score (5-fold); Macro F1; Accuracy; Macro F1 (10-fold); LogLoss; Accuracy (5-fold),Behavioral Malware Detection; Malware Detection; Behavioral Malware Classification; Android Malware Detection,Miscellaneous,**Malware Classification** is the process of assigning a malware sample to a specific malware family. Malware within a family shares similar properties that can be used to create signatures for detect...
Document Ranking,7,MSLR WEB30K; CLUE; MQ2008; DaReCzech; BASIR; Qulac; Istella LETOR,ClueWeb09-B; DaReCzech,ERR@20; P@10; nDCG@20,Session Search,Natural Language Processing,"Sort documents according to some criterion so that the ""best"" results appear early in the result list displayed to the user (Source: Wikipedia)."
Extreme Summarization,7,XSum; TLDR9+; SummZoo; GEM; CiteSum; Elsevier OA CC-BY; SciTLDR,GEM-XSum; XSum; CiteSum; TLDR9+,ROUGE-1; RG-L(%); ROUGE-2; BLEU score; METEOR; Parameters; RG-2(%); RG-1(%); ROUGE-L,N/A,Natural Language Processing,Image credit: [TLDR: Extreme Summarization of Scientific Documents](https://arxiv.org/pdf/2004.15011v3.pdf)
Language Acquisition,7,NLI-PT; Duolingo SLAM Shared Task; Duolingo Spaced Repetition Data; New Brown Corpus; Avalinguo Audio Dataset; BabySLM; BLiMP,SLAM 2018,AUC,Grounded language learning,Natural Language Processing,Language acquisition refers to tasks related to the learning of a second language.
Systematic Generalization,7,PCFG SET; ZEST; GSCAN; S2B; Mathematics Dataset; SCAN; Cryptics,N/A,N/A,N/A,Reasoning,N/A
General Reinforcement Learning,7,Avalon; ProcGen; POPGym; Obstacle Tower; WLD; bipedal-skills; PackIt,Obstacle Tower (Strong Gen) varied; Obstacle Tower (No Gen) varied; Obstacle Tower (No Gen) fixed; Obstacle Tower (Weak Gen) varied; Obstacle Tower (Weak Gen) fixed; Obstacle Tower (Strong Gen) fixed,Score,Model-based Reinforcement Learning; Offline RL,Reasoning; Robots; Methodology; Playing Games,N/A
Twitter Sentiment Analysis,7,ArSen-20; #chinahate; SentimentArcs: Sentiment Reference Corpus for Novels; Crypto related tweets from 10.10.2020 to 3.3.2021; Twitter Sentiment Analysis; RETWEET; Multi-Class Depression Detection Dataset,N/A,N/A,Tweet-Reply Sentiment Analysis,Natural Language Processing,Twitter sentiment analysis is the task of performing sentiment analysis on tweets from Twitter.
Toxic Comment Classification,7,UIT-ViCTSD; Jigsaw Toxic Comment Classification Dataset; K-MHaS: Korean Multi-label Hate Speech Dataset; WikiDetox; Civil Comments; FairPrism; CAD,N/A,N/A,N/A,N/A,N/A
News Summarization,7,VNDS; DICE: a Dataset of Italian Crime Event news; Reddit Ideological and Extreme Bias Dataset; FIB; ECTSum; M3LS; Bengali Curated News Summary Dataset,N/A,N/A,N/A,N/A,N/A
Masked Language Modeling,7,GENTER; DiFair; blbooks; GENTYPES; LatamXIX; GENEUTRAL; Spanish Corpus XIX,N/A,N/A,N/A,N/A,N/A
Concept-based Classification,6,CelebA; AwA2; CUB-200-2011; AwA; CheXpert; aPY,CelebA; AwA2; CUB-200-2011; CheXpert; aPY,Concept Accuracy (%); Task Accuracy (%),N/A,Computer Vision,Image classification using human-interpretable concepts
Knowledge Distillation,6,CIFAR-100; PASCAL VOC; ImageNet; COCO (Common Objects in Context); KITTI; Cityscapes,en pt br; en es; CIFAR-100; PASCAL VOC; big content; ImageNet; COCO 2017 val; COCO (Common Objects in Context); KITTI; Cityscapes,; mAP; AP@0.75; RMSE; model size;  box AP; Top-1 accuracy %; Top-1 Accuracy (%); AP@0.5; CRD training setting,Self-Knowledge Distillation; Data-free Knowledge Distillation,Computer Vision; Natural Language Processing,Knowledge distillation is the process of transferring knowledge from a large model to a smaller one. While large models (such as very deep neural networks or ensembles of many models) have higher know...
Constituency Parsing,6,Taiga Corpus; PCC; Penn Treebank; MASC; Alexa Point of View; FLUE,CTB7; ATB; Penn Treebank; CTB5,F1; F1 score,Constituency Grammar Induction,Natural Language Processing,Constituency parsing aims to extract a constituency-based parse tree from a sentence that  represents its syntactic structure according to a [phrase structure grammar](https://en.wikipedia.org/wiki/Ph...
Document Text Classification,6,Kompetencer; Tobacco-3482; CUB-200-2011; WOS Hierarchical Text Classification; MatriVasha:; Food-101,Tobacco-3482; CUB-200-2011; Food-101; Tobacco small-3482,Accuracy (%); Accuracy; Training time (min); Training time (hours),Learning with noisy labels; Political Salient Issue Orientation Detection; Multi-Label Classification Of Biomedical Texts,Medical; Computer Vision; Natural Language Processing,N/A
Multi-Modal Document Classification,6,RVL-CDIP; Tobacco-3482; Reuters-21578; CUB-200-2011; HeriGraph; Food-101,N/A,N/A,N/A,N/A,N/A
Cross-Domain Few-Shot,6,Earth on Canvas; Places205; mini-Imagenet; CUB-200-2011; Places; EuroSAT,CropDisease; miniImagenet; Plantae; CUB; ChestX; Places; EuroSAT; ISIC2018; cars,Accuracy (%); 5 shot,cross-domain few-shot learning,Computer Vision,N/A
Few-Shot Relation Classification,6,FewRel 2.0; FREDo; TexRel; DocRED; SciERC; FewRel,N/A,N/A,N/A,N/A,N/A
Generative Question Answering,6,Reddit; LLeQA; CoQA; FrenchMedMCQA; CICERO; Reddit Ideology Database,N/A,N/A,N/A,N/A,N/A
Environmental Sound Classification,6,SONYC-UST-V2; ESC50; SINGA:PURA; ESC-50; FSD50K; UrbanSound8K,ESC-50; UrbanSound8K; FSD50K,Accuracy; mAP,Self-Supervised Sound Classification,Audio,Classification of Environmental Sounds. Most often sounds found in Urban environments. Task related to noise monitoring.
Community Question Answering,6,Quora Question Pairs; PerCQA; ANTIQUE; AmazonQA; SE-PQA; CQASUMM,N/A,N/A,N/A,N/A,N/A
Text Spotting,6,Total-Text; LSVTD; ICDAR 2015; SCUT-CTW1500; Textual Visual Semantic Dataset; UCLA Protest Image,Inverse-Text; SCUT-CTW1500; Total-Text; ICDAR 2015,F-measure (%) - Strong Lexicon; F-measure (%) - Generic Lexicon; F-Measure (%) - Full Lexicon; F-measure (%) - Full Lexicon; F-measure (%) - No Lexicon; F-measure (%) - Weak Lexicon,N/A,Computer Vision,Scene Text Spotting is the combination of Scene Text Detection and Scene Text Recognition in an end-to-end manner.  It is the ability to read natural text in the wild.
Source-Free Domain Adaptation,6,SYNTHIA; VisDA-2017; GTA5; Dark Zurich; ACDC (Adverse Conditions Dataset with Correspondences); PACS,Cityscapes to Dark Zurich; SYNTHIA-to-Cityscapes; Cityscapes to ACDC; VisDA-2017; PACS; GTA5 to Cityscapes; 	VIPER-to-Cityscapes,Accuracy; Average Accuracy; mIoU,3D Source-Free Domain Adaptation; Source Free Object Detection,Computer Vision,"Source-Free Domain Adaptation (SFDA) is a domain adaptation method in machine learning and computer vision where the goal is to adapt a pre-trained model to a new, target domain without access to the ..."
Table-to-Text Generation,6,RotoWire; Wikipedia Person and Animal Dataset; WikiBio; E2E; DART; WebNLG,RotoWire; Wikipedia Person and Animal Dataset; WebNLG (All); E2E; WikiBio; WebNLG (Unseen); WebNLG (Seen); DART, Content Selection (F1); BLEU; NIST; TER; BERT; Mover; PARENT; ROUGE;  Content Ordering; METEOR,KB-to-Language Generation,Natural Language Processing,**Here is the provided data converted into a table format for clarity:  COUNTRIES	1971-2010	2011	2012	2013	2014	2015	2016	2017	2018  									  Saudi Arabia	2742962	222247	358560	270502	312489	522750	...
Multi-Source Unsupervised Domain Adaptation,6,ImageCLEF-DA; GTZAN; Tennessee Eastman Process; DomainNet; Office-Home; Office-31,N/A,N/A,N/A,N/A,N/A
AMR Parsing,6,LDC2020T02; Groningen Meaning Bank; LDC2017T10; The Little Prince; New3; Bio,LDC2020T02; LDC2017T10; LDC2014T12; LDC2015E86; The Little Prince; New3; LDC2014T12:; Bio,Smatch; F1 Newswire; F1 Full,N/A,Natural Language Processing,"Each AMR is a single rooted, directed graph. AMRs include PropBank semantic roles, within-sentence coreference, named entities and types, modality, negation, questions, quantities, and so on. [See](ht..."
News Generation,6,Reddit; Reddit Ideological and Extreme Bias Dataset; FakeNewsNet; BalitaNLP; Reddit Ideology Database; Ice Hockey News Dataset,N/A,N/A,Headline Generation,Natural Language Processing,Generation of larger segments of text with consistent topic and evolving story.
Compositional Zero-Shot Learning,6,AO-CLEVr; UT Zappos50K; ReaSCAN; MIT-States; UT-Zappos50K; C-GQA,N/A,N/A,N/A,N/A,N/A
Lexical Entailment,6,TERRa; EVALution; HyperLex; SherLIiC; Persian NLP Hub; IMPPRES,N/A,N/A,N/A,N/A,N/A
Multimodal Recommendation,6,Amazon Beauty; Amazon Baby; Amazon Office Products; Amazon Review; Amazon Toys & Games; Amazon Digital Music,N/A,N/A,N/A,N/A,N/A
Age And Gender Classification,6,BN-AuthProf; mebeblurf; Age and Gender; LAGENDA; IMDB-Clean; CI-MNIST,BN-AuthProf; Adience Age; Adience Gender,F1 score; Accuracy (5-fold),Author Profiling,Natural Language Processing,"Age and gender classification is a dual-task of identifying the age and gender of a person from an image or video.    <span style=""color:grey; opacity: 0.6"">( Image credit: [Multi-Expert Gender Classi..."
Text Categorization,6,MNAD; DICE: a Dataset of Italian Crime Event news; Text_VPH; Multilingual Reuters; NatCat; DAWT,N/A,N/A,N/A,N/A,N/A
Genre classification,6,PTVD; FMA; Book Cover Dataset; Trailers12k; MuMu; Moviescope,N/A,N/A,N/A,N/A,N/A
Meme Classification,6,Tamil Memes; Harm-C; Hateful Memes; HarMeme; MMHS150k; MultiOFF,Hateful Memes; Tamil Memes; MultiOFF,F1; Accuracy; Micro-F1; ROC-AUC,Hateful Meme Classification,Computer Vision; Natural Language Processing,Meme classification refers to the task of classifying internet memes.
multimodal generation,6,Multi-Modal CelebA-HQ; Alex-20; taste-music-dataset; MedTrinity-25M; REBUS; MMNeedle,N/A,N/A,N/A,N/A,N/A
Meeting Summarization,6,ELITR Minuting Corpus; ICSI Meeting Corpus; AMI Meeting Corpus; QMSum; MeetingBank; public_meetings,ICSI Meeting Corpus; AMI Meeting Corpus,ROUGE-1 F1,N/A,Natural Language Processing,Generating a summary from meeting transcriptions.     A survey for this task: [Abstractive Meeting Summarization: A Survey](https://paperswithcode.com/paper/abstractive-meeting-summarization-a-survey)
Text-to-Music Generation,6,AIME; Song Describer Dataset; MusicBench; JamendoMaxCaps; MusicCaps; PIAST,MusicCaps; MusicBench,FD; FAD; CLAP_MS; FD_openl3; CLAP_LAION; IS; KL_passt,N/A,Audio,N/A
text annotation,6,"VMD; Text_VPH; OASST1; MATHWELL Human Annotation Dataset; MIBot - Motivational Interviewing for Smoking Cessation Dataset, based on MIBOT Version 6.3A; Reddit Posts Related To Eating Disorders and Dieting",N/A,N/A,N/A,Natural Language Processing,N/A
Generalized Few-Shot Learning,5,SUN; AwA2; Geoclidean-Elements; CUB-200-2011; AwA,SUN; CUB; AwA2,Per-Class Accuracy (10-shots); Per-Class Accuracy (5-shots); Per-Class Accuracy (20-shots); Per-Class Accuracy  (2-shots); Per-Class Accuracy (2-shots); Per-Class Accuracy (1-shot),Long-tail Learning,Methodology,N/A
Reading Comprehension (Zero-Shot),5,Belebele; CMRC 2018; DRCD; CMRC; DuReader,N/A,N/A,N/A,N/A,N/A
Reading Comprehension (One-Shot),5,Belebele; CMRC 2018; DRCD; CMRC; DuReader,N/A,N/A,N/A,N/A,N/A
Reading Comprehension (Few-Shot),5,Belebele; CMRC 2018; DRCD; CMRC; DuReader,N/A,N/A,N/A,N/A,N/A
Open Intent Discovery,5,BANKING77; DBpedia; ATIS; CLINC150; SNIPS,BANKING77; DBpedia; Stackoverflow; ATIS; CLINC150; SNIPS,ARI; ACC; Clustering Accuracy; NMI,N/A,Natural Language Processing,Open intent discovery aims to leverage limited prior knowledge of known intents to find fine-grained known and open intent-wise clusters.
Synthetic-to-Real Translation,5,SYNTHIA; Syn2Real; WinSyn; GTA5; Sims4Action,N/A,N/A,N/A,N/A,N/A
Variational Inference,5,HASY; CIFAR-100; WikiAtomicEdits; Silhouettes; WI-LOCNESS,N/A,N/A,N/A,N/A,N/A
Universal Domain Adaptation,5,VisDA-2017; All-day CityScapes; DomainNet; Office-Home; Office-31,Office-Home; Office-31; DomainNet; VisDA2017,VLM; Source-Free; H-Score; Source-free; H-score,N/A,Computer Vision,N/A
Paper generation,5,"2017 Robotic Instrument Segmentation Challenge; ICLR Database; PubMed Paper Reading Dataset; ACL Title and Abstract Dataset; PubMed Term, Abstract, Conclusion, Title Dataset",N/A,N/A,N/A,N/A,N/A
AMR-to-Text Generation,5,LDC2020T02; LDC2017T10; The Little Prince; New3; Bio,N/A,N/A,N/A,N/A,N/A
