Task Name,Dataset Count,Common Datasets (Top 10),Benchmarks,SOTA Metrics,Subtasks,Categories,Description (First 200 chars)
Text Clustering,5,MTEB; DICE: a Dataset of Italian Crime Event news; COVID-19 Twitter Chatter Dataset; Urdu News Headlines Dataset; 20 Newsgroups,Urdu News Headlines Dataset; 20 Newsgroups; MTEB,Accuracy; Related Headlines; V-Measure,Hierarchical Text Clustering; Open Intent Discovery; Short Text Clustering,Natural Language Processing,Grouping a set of texts in such a way that objects in the same group (called a cluster) are more similar (in some sense) to each other than to those in other groups (clusters). (Source: Adapted from W...
Code Documentation Generation,5,Java scripts; CodeSearchNet; notebookcdg; DeepCom-Java; PyTorrent,CodeSearchNet - JavaScript; CodeSearchNet; CodeSearchNet - Ruby; CodeSearchNet - Java; CodeSearchNet - Python; CodeSearchNet - Php; CodeSearchNet - Go,Smoothed BLEU-4,CodeSearchNet - Java,Computer Code,"Code Documentation Generation is a supervised task where a code function is the input to the model, and the model generates the documentation for this function.    Description from: [CodeTrans: Toward..."
Multimodal Machine Translation,5,WMT 2016 Biomedical; WMT 2016 IT; Hindi Visual Genome; Multi30K; HaVG,Hindi Visual Genome (Challenge Set); Multi30K; Hindi Visual Genome (Test Set),BLEU (EN-HI); Meteor (EN-DE); BLUE (DE-EN); Meteor (EN-FR); BLEU (EN-DE),Multimodal Lexical Translation; Face to Face Translation,Computer Vision; Natural Language Processing,"Multimodal machine translation is the task of doing machine translation with multiple data sources - for example, translating ""a bird is flying over water"" + an image of a bird over water to German te..."
Translation eng-fra,5,TICO-19; Tatoeba; Multi30K; FLoRes-101; FLoRes-200,N/A,N/A,N/A,N/A,N/A
Morphological Analysis,5,Polyglot-NER; Wikipedia Title; CELEX; Egyptian Arabic Segmentation Dataset; TrMor2018,N/A,N/A,N/A,Natural Language Processing,**Morphological Analysis** is a central task in language processing that can take a word as input and detect the various morphological entities in the word and provide a morphological representation o...
Low-Resource Neural Machine Translation,5,Leipzig Corpora; KurdishInterdialect; CVIT PIB; FLoRes; ASPEC,N/A,N/A,N/A,N/A,N/A
Goal-Oriented Dialogue Systems,5,DSTC7 Task 1; MMD; MultiDoc2Dial; MetaLWOz; LLMafia,N/A,N/A,N/A,N/A,N/A
Zero-shot Classification (unified classes),5,AID; SynthPAI; RESISC45; LLVIP; ImageNet_CN,N/A,N/A,N/A,N/A,N/A
Hateful Meme Classification,5,PrideMM; Harm-C; Harm-P; Hateful Memes; HarMeme,N/A,N/A,N/A,N/A,N/A
Long Form Question Answering,5,ELI5; QuALITY; LLeQA; DARai; MMInstruct-GPT4V,N/A,N/A,N/A,N/A,N/A
Cross-Lingual Question Answering,5,MLQA; TyDiQA-GoldP; QALD-9-Plus; LitMind Dictionary; XQuAD,N/A,N/A,N/A,N/A,N/A
Transliteration,5,ANETAC; Dakshina; TSAC; Bianet; ArzEn,N/A,N/A,N/A,N/A,N/A
Multilabel Text Classification,5,NLP Taxonomy Classification Data; TuPyE-Dataset; EURLEX57K; arXiv Categories; HumSet,N/A,N/A,N/A,N/A,N/A
Material Classification,5,MINC; LabPics; OpenSurfaces; SpectroVision; Touch and Go,N/A,N/A,N/A,Computer Vision,N/A
Graph Generation,5,STREETS; WikiGraphs; TRN; PISC; Torque,Toulouse Road Network,StreetMover,N/A,Graphs,"**Graph Generation** is an important research area with significant applications in drug and material designs.   <span class=""description-source"">Source: [Graph Deconvolutional Generation ](https://ar..."
Texture Classification,5,ISOD; ElBa; CBTex; Multidimensional Texture Perception; ITD,N/A,N/A,N/A,Computer Vision,"**Texture Classification** is a fundamental issue in computer vision and image processing, playing a significant role in many applications such as medical image analysis, remote sensing, object recogn..."
Crop Classification,5,SemanticSugarBeets; SICKLE; CropAndWeed; EuroCrops; Sen4AgriNet,CropHarvest - Brazil; CropHarvest multicrop - Global; CropHarvest - Global; CropHarvest - Kenya; CropHarvest - Togo,Average Accuracy; Target Binary F1; AUC; F1 Macro,N/A,Miscellaneous; Computer Vision,N/A
Knowledge Probing,5,TOFU; PopQA; BEAR-probe; Spectral Detection and Analysis Based Paper(SDAAP) dataset; BioLAMA,N/A,N/A,N/A,N/A,N/A
Multi-task Language Understanding,5,BIG-bench; MGSM; Tasksource; BBH; MML,N/A,N/A,N/A,N/A,N/A
Temporal Relation Classification,5,2012 i2b2 Temporal Relations; Catalan TimeBank 1.0; MATRES; French Timebank; SupplyGraph,N/A,N/A,N/A,N/A,N/A
Speech-to-Speech Translation,5,LibriS2S; CVSS; Heroes Corpus; TAT; SpeechMatrix,TAT; CVSS; FLEURS X-eng,Parameters; ASR-BLEU (Test); ASR-BLEU (Dev); ASR-BLEU,N/A,Speech,"Speech-to-speech translation (S2ST) consists on translating speech from one language to speech in another language. This can be done with a cascade of automatic speech recognition (ASR), text-to-text ..."
Protein Language Model,5,CATH 4.3; Protein-Instructions-OOD; DAVIS-DTA; ProteinGym; CATH 4.2,N/A,N/A,N/A,N/A,N/A
Spatial Reasoning,5,MMVP; EmbSpatial-Bench; RealWorldQA; BlINK; RePAIR Dataset,N/A,N/A,N/A,N/A,N/A
Gender Classification,5,IUST_PersonReID; PsyMo; IMDB-WIKI; BN-AuthProf; inaGVAD,N/A,N/A,N/A,N/A,N/A
Long-Context Understanding,5,L-Eval; LongBench; TIME; NoLiMa; MMNeedle,Ada-LEval (TSort); Ada-LEval (BestAnswer); LongBench; L-Eval; MMNeedle,"10 Images, 8*8 Stitching, Exact Accuracy; 4k; 32k; 1k; 128k; 1 Image, 4*4 Stitching, Exact Accuracy; 10 Images, 1*1 Stitching, Exact Accuracy; 12k; 10 Images, 2*2 Stitching, Exact Accuracy; 1 Image, 2*2 Stitching, Exact Accuracy",N/A,Natural Language Processing,N/A
Multi Label Text Classification,4,GoEmotions; MNIST; HateScore; CARER,N/A,N/A,N/A,N/A,N/A
Multi-Human Parsing,4,LLMafia; MHP; CCIHP; PASCAL-Part,N/A,N/A,N/A,N/A,N/A
Predicate Classification,4,ImageCLEF-DA; Visual Genome; Haystack; 3RScan,N/A,N/A,N/A,N/A,N/A
Zero-shot Audio Classification,4,VGG-Sound; UrbanSound8K; ESC-50; AudioSet,N/A,N/A,N/A,N/A,N/A
Intent Discovery,4,SNIPS; diaforge-utc-r-0725; ATIS; Persian-ATIS,SNIPS; ATIS; Persian-ATIS,ARI,N/A,Natural Language Processing,"Given a set of labelled and unlabelled utterances, the idea is to identify existing (known) intents and potential (new intents) intents. This method can be utilised in conversational system setting."
Unsupervised Text Classification,4,AG News; Medical Abstracts; 20NewsGroups; Yahoo! Answers,N/A,N/A,N/A,N/A,N/A
Zero-Shot Text Classification,4,AG News; HateXplain; Events classification - Biotech news; This is not a Dataset,N/A,N/A,N/A,N/A,N/A
Few-Shot Text Classification,4,RAFT; SST-5; SST; Events classification - Biotech news,ODIC 10-way (10-shot); RAFT; SST-5; Average on NLP datasets; ODIC 5-way (5-shot); ODIC 5-way (10-shot); Amazon Counterfeit; ODIC 10-way (5-shot),NIS; TEH;  Over; TAI; TC; Avg; ToS; B77; ADE; SOT,Zero-Shot Out-of-Domain Detection,Natural Language Processing,Few-shot Text Classification predicts the semantic label of a given text with a handful of supporting instances [1](https://aclanthology.org/2022.emnlp-main.87)
Citation Intent Classification,4,REFCAT; ACL ARC; unarXive; SciCite,N/A,N/A,N/A,N/A,N/A
Partial Domain Adaptation,4,Office-Home; Office-31; VisDA-2017; DomainNet,N/A,N/A,N/A,N/A,N/A
Multi-target Domain Adaptation,4,Office-Home; OBJ-MDA; Office-31; DomainNet,Office-Home; Office-31; DomainNet; OBJ-MDA,Accuracy; mAP@0.5,N/A,Computer Vision,The idea of Multi-target Domain Adaptation is to adapt a model from a single labelled source domain to multiple unlabelled target domains.
Knowledge Graph Embedding,4,KG20C; KGRC-RDF-star; GEval for KGRC-RDF-star; FB15k,FB15k,MRR,Open Knowledge Graph Embedding,Knowledge Base,N/A
Multi-modal Classification,4,Gaze-CIFAR-10; VGG-Sound; Mudestreda; AudioSet,VGG-Sound; AudioSet,Top-1 Accuracy; Top-5 Accuracy; Average mAP,Image-text Classification,Miscellaneous,N/A
Breast Tumour Classification,4,BCNB; PCam; Breast Lesion Detection in Ultrasound Videos (CVA-Net); BreastClassifications4,PCam,Accuracy; AUC,N/A,Medical,N/A
Logical Reasoning Question Answering,4,JustLogic; ReClor; SUTD-TrafficQA; RoomSpace,N/A,N/A,N/A,N/A,N/A
Translation ces-eng,4,Multi30K; FLoRes-200; Tatoeba; FLoRes-101,N/A,N/A,N/A,N/A,N/A
Translation deu-fra,4,Multi30K; FLoRes-200; Tatoeba; FLoRes-101,N/A,N/A,N/A,N/A,N/A
Spoken language identification,4,VoxForge; FLEURS; IndicTTS; VOXLINGUA107,N/A,N/A,N/A,N/A,N/A
Music Auto-Tagging,4,TimeTravel; MSD; MagnaTagATune; PIAST,TimeTravel; Million Song Dataset; MagnaTagATune; MagnaTagATune (clean),0..5sec; PR-AUC; ROC-AUC; ROC AUC,N/A,Music,N/A
Music Tagging,4,PIAST; ATD-Dataset; MagnaTagATune; EMOPIA,N/A,N/A,N/A,N/A,N/A
End-To-End Dialogue Modelling,4,Arabic-ToD; MultiWOZ; BiToD; LLMafia,N/A,N/A,N/A,N/A,N/A
Unsupervised Machine Translation,4,CCMatrix; WMT 2014; WMT 2016 News; WMT 2016,N/A,N/A,N/A,N/A,N/A
Triple Classification,4,YAGO; CoDEx Small; CoDEx Large; CoDEx Medium,YAGO39K,Accuracy; Recall; F1-Score; Precision,Knowledge Graph Embeddings,Graphs,"Triple classification aims to judge whether a given triple (h, r, t) is correct or not with respect to the knowledge graph."
Speech-to-Text Translation,4,Kosp2e; MediBeng; MuST-C; CoVoST,MuST-C; FLEURS eng-X; MediBeng; CoVoST 2 eng-X; MuST-C EN->FR; libri-trans; CoVoST 2 X-eng; MuST-C EN->ES; MuST-C EN->DE; MuST-C EN->NL,BLEU; Case-sensitive sacreBLEU; SacreBLEU; Bleu; Case-insensitive sacreBLEU; Case-sensitive tokenized BLEU; Case-insensitive tokenized BLEU,Simultaneous Speech-to-Text Translation,Natural Language Processing,"Translate audio signals of speech in one language into text in a foreign language, either in an end-to-end or cascade manner."
Cloze (multi-choices) (Zero-Shot),4,CMRC 2019; CMRC 2017; ChID; CMRC,N/A,N/A,N/A,N/A,N/A
Cloze (multi-choices) (Few-Shot),4,CMRC 2019; CMRC 2017; ChID; CMRC,N/A,N/A,N/A,N/A,N/A
Morphological Tagging,4,iLur News Texts; CoNLL 2017 Shared Task - Automatically Annotated Raw Texts and Word Embeddings; CoNLL; Szeged Corpus,N/A,N/A,N/A,Natural Language Processing,"Morphological tagging is the task of assigning labels to a sequence of tokens that describe them morphologically. As compared to Part-of-speech tagging, morphological tagging also considers morphologi..."
Knowledge Graph Embeddings,4,OLPBENCH; KGRC-RDF-star; MutualFriends; GEval for KGRC-RDF-star,N/A,N/A,N/A,N/A,N/A
Zero-Shot Cross-Lingual Transfer,4,IGLUE; xSID; MaRVL; XTREME,N/A,N/A,N/A,N/A,N/A
Translation eng-spa,4,TICO-19; FLoRes-101; FLoRes-200; Tatoeba,N/A,N/A,N/A,N/A,N/A
Translation ben-eng,4,TICO-19; FLoRes-101; FLoRes-200; Tatoeba,N/A,N/A,N/A,N/A,N/A
Arabic Sentiment Analysis,4,LABR; ArSentD-LEV; ArSen; ArSen-20,!(()&&!|*|*|,0-shot MRR,N/A,Natural Language Processing,"Arabic sentiment analysis is the process of computationally identifying and categorizing opinions expressed in a piece of arabic text, especially in order to determine whether the writer's attitude to..."
Grasp Generation,4,A Billion Ways to Grasp; GRAB; FFHNet; rc_49,N/A,N/A,Controllable Grasp Generation; Grasp rectangle generation,Robots; Computer Vision,N/A
text-based games,4,TextWorld KG; Jericho; Cards Against Humanity; LLMafia,N/A,N/A,N/A,Playing Games,Text-based games to evaluate the Reinforcement Learning Agents
Few-shot NER,4,Chem-FINESE; Few-NERD; WNUT 2017; XGLUE,N/A,N/A,N/A,N/A,N/A
Weakly Supervised Classification,4,ShARe/CLEF 2014: Task 2 Disorders; BCNB; THYME-2016; UBI-Fights,ShARe/CLEF 2014: Task 2 Disorders; THYME-2016,F1,Weakly Supervised Data Denoising,Natural Language Processing,N/A
Conditional Text Generation,4,Lipogram-e; WikiGraphs; VitaminC; BalitaNLP,Lipogram-e,Ignored Constraint Error Rate,Multimedia Generative Script Learning; Contextualized Literature-based Discovery,Natural Language Processing,The task of generating text according to some pre-specified conditioning (e.g. topic or sentiment or constraint)
Multi-hop Question Answering,4,MuSiQue-Ans; ConcurrentQA Benchmark; MultiQ; SPARTQA -,MuSiQue-Ans; ConcurrentQA,An; Sp; Answer F1,N/A,Knowledge Base,N/A
Answer Generation,4,CICERO; WeiboPolls; QAMPARI; LLMafia,N/A,N/A,N/A,N/A,N/A
Temporal/Casual QA,4,TimeQA; NExT-QA; TIME; TimelineKGQA,N/A,N/A,N/A,N/A,N/A
Math Word Problem SolvingΩ,4,ParaMAWPS; DART-Math-Uniform; MAWPS; DART-Math-Hard,N/A,N/A,N/A,N/A,N/A
Science Question Answering,4,FrenchMedMCQA; BioFuelQR; SemOpenAlex; ScienceQA,N/A,N/A,N/A,N/A,N/A
Music Recommendation,4,Music4All-Onion; YouTube8M-MusicTextClips; PIAST; MuseChat Dataset,N/A,N/A,N/A,N/A,N/A
Text Reranking,4,Claim Matching Robustness; Cards Against Humanity; MTEB; Multi-EuP: The Multilingual European Parliament Dataset for Analysis of Bias in Information Retrieval,N/A,N/A,N/A,N/A,N/A
Lay Summarization,4,PLOS; AUTH at BioLaySumm 2024 - Bringing Scientific Content to Kids; eLife; AUTH at BioLaySumm 2024: Bringing Scientific Content to Kids,N/A,N/A,N/A,N/A,N/A
Sports Understanding,4,QASports; MultiSenseBadminton; DeepSportRadar-v1; Predictive Model for Assessing Knee Muscle Injury Risk in Athletes and Non-Athletes Using sEMG,N/A,N/A,N/A,N/A,N/A
Out-of-Distribution Generalization,4,UrbanCars; ImageNet-W; shape bias; Object-Centric Stylized COCO,N/A,N/A,N/A,N/A,N/A
Text2text Generation,4,Kaleidoscope; HarmfulQA; diaforge-utc-r-0725; MTTN,lmqg/qg_squad; lmqg/qg_jaquad; MTTN: Multi-Pair Text to Text Narratives for Prompt Generation,ROUGE-1,Keyphrase Generation; Sketch-to-text Generation; Figurative Language Visualization,Natural Language Processing,N/A
Referring expression generation,4,ColonINST-v1; A Game Of Sorts; ColonINST-v1 (Seen); ColonINST-v1 (Unseen),ColonINST-v1 (Seen); ColonINST-v1 (Unseen),Accuray,N/A,Computer Vision,Generate referring expressions
tabular-classification,4,TML1M; AjwaOrMedjool; TACM12K; TLF2K,N/A,N/A,N/A,N/A,N/A
Classification with Binary Weight Network,3,CIFAR-10; MNIST; CIFAR-100,N/A,N/A,N/A,N/A,N/A
Data-free Knowledge Distillation,3,SQuAD; QNLI; GLUE,SQuAD; QNLI,Accuracy; Exact Match,Benchmarking,Natural Language Processing,N/A
Sentence-Embedding,3,McQueen; Cards Against Humanity; GLUE,N/A,N/A,N/A,N/A,N/A
Classification with Binary Neural Network,3,CIFAR-10; ImageNet; CIFAR-100,N/A,N/A,N/A,N/A,N/A
Human Parsing,3,MHP; 4D-DRESS; PASCAL Context,4D-DRESS; PASCAL Context,mIoU; mAcc,Multi-Human Parsing,Computer Vision,"Human parsing is the task of segmenting a human image into different fine-grained semantic parts such as head, torso, arms and legs.    <span style=""color:grey; opacity: 0.6"">( Image credit: [Multi-Hu..."
Unsupervised KG-to-Text Generation,3,Visual Genome; GenWiki; WebNLG,N/A,N/A,N/A,N/A,N/A
Few-Shot Class-Incremental Learning,3,CUB-200-2011; mini-Imagenet; CIFAR-100,N/A,N/A,N/A,N/A,N/A
text2text-generation,3,ChatGPT Paraphrases; ChatHaruhi; SQuAD,N/A,N/A,N/A,N/A,N/A
SQL Parsing,3,IMDb Movie Reviews; ATIS; Yelp,N/A,N/A,N/A,N/A,N/A
Chinese Sentiment Analysis,3,STATE ToxiCN; SST; SST-2,N/A,N/A,N/A,N/A,N/A
Unsupervised Text Style Transfer,3,Yelp2018; GYAFC; Yelp,N/A,N/A,N/A,N/A,N/A
Unsupervised Opinion Summarization,3,SPACE (Opinion Summarization); AmaSum; Yelp,N/A,N/A,N/A,N/A,N/A
Multibehavior Recommendation,3,Multi-behavior Taobao; MovieLens; Yelp,N/A,N/A,N/A,N/A,N/A
Molecular Graph Generation,3,QM9; MOSES; ZINC,N/A,N/A,N/A,N/A,N/A
Blended-target Domain Adaptation,3,Office-Home; Office-31; DomainNet,N/A,N/A,N/A,N/A,N/A
Talking Head Generation,3,VoxCeleb1; AnimeCeleb; VoxCeleb2,VoxCeleb1 - 1-shot learning; 100 sleep nights of 8 caregivers; VoxCeleb2 - 32-shot learning; VoxCeleb1 - 8-shot learning; VoxCeleb2 - 1-shot learning; VoxCeleb1 - 32-shot learning; VoxCeleb2 - 8-shot learning,LPIPS; inference time (ms); 10%; FID; CSIM; SSIM; Normalized Pose Error,Unconstrained Lip-synchronization,Computer Vision,"Talking head generation is the task of generating a talking face from a set of images of a person.    <span style=""color:grey; opacity: 0.6"">( Image credit: [Few-Shot Adversarial Learning of Realistic..."
Annotated Code Search,3,ISAdetect dataset; PACS; PyTorrent,N/A,N/A,N/A,N/A,N/A
Automatic Sleep Stage Classification,3,Montreal Archive of Sleep Studies; Sleep-EDF; ISRUC-Sleep,Sleep-EDF; ISRUC-Sleep,Cohen’s Kappa score; Number of parameters (M); Accuracy; Kappa; AUROC,N/A,Medical,N/A
Topological Data Analysis,3,Reddit; REDDIT-5K; REDDIT-12K,N/A,N/A,N/A,Graphs,N/A
Sentence Fusion,3,DiscoFuse; PoC; WikiSplit,N/A,N/A,N/A,N/A,N/A
Few-Shot Point Cloud Classification,3,ModelNet; ScanObjectNN; ModelNet40-C,N/A,N/A,N/A,N/A,N/A
Recipe Generation,3,Recipe1M+; Food.com Recipes and Interactions; RecipeNLG,allrecipes.com; Food.com; Now You're Cooking!; Recipe1M; RecipeNLG,BLEU; GLEU; D-2; F1; BPE Perplexity; Rouge-L; BLEU-1; Mean IoU; Word Error Rate (WER); D-1,N/A,Miscellaneous; Natural Language Processing,"Food recipe generation from ingredients, title and/or food images."
Translation ces-deu,3,Multi30K; FLoRes-200; Tatoeba,N/A,N/A,N/A,N/A,N/A
Graph Similarity,3,Linux; IMDb Movie Reviews; IMDB-MULTI,IMDb,mse (10^-3),N/A,Graphs,N/A
Spoken Dialogue Systems,3,Dialogue State Tracking Challenge; CQR; SD-Eval,N/A,N/A,N/A,Speech,N/A
Multi-Hop Reading Comprehension,3,ConcurrentQA Benchmark; CodeQueries; MedHop,N/A,N/A,N/A,N/A,N/A
Translation spa-eng,3,TICO-19; FLoRes-101; Tatoeba,N/A,N/A,N/A,N/A,N/A
Translation afr-deu,3,FLoRes-101; FLoRes-200; Tatoeba,N/A,N/A,N/A,N/A,N/A
Translation afr-eng,3,FLoRes-101; FLoRes-200; Tatoeba,N/A,N/A,N/A,N/A,N/A
Translation cat-eng,3,FLoRes-101; FLoRes-200; Tatoeba,N/A,N/A,N/A,N/A,N/A
Translation rus-por,3,TICO-19; FLoRes-200; Tatoeba,N/A,N/A,N/A,N/A,N/A
Translation eng-por,3,FLoRes-101; FLoRes-200; Tatoeba,N/A,N/A,N/A,N/A,N/A
Translation ara-eng,3,TICO-19; FLoRes-101; Tatoeba,N/A,N/A,N/A,N/A,N/A
Translation cym-eng,3,FLoRes-101; FLoRes-200; Tatoeba,N/A,N/A,N/A,N/A,N/A
Translation dan-eng,3,FLoRes-101; FLoRes-200; Tatoeba,N/A,N/A,N/A,N/A,N/A
Translation heb-eng,3,FLoRes-101; FLoRes-200; Tatoeba,N/A,N/A,N/A,N/A,N/A
Translation hun-eng,3,FLoRes-101; FLoRes-200; Tatoeba,N/A,N/A,N/A,N/A,N/A
Translation cat-fra,3,FLoRes-101; FLoRes-200; Tatoeba,N/A,N/A,N/A,N/A,N/A
Translation glg-spa,3,FLoRes-101; FLoRes-200; Tatoeba,N/A,N/A,N/A,N/A,N/A
Translation por-fra,3,TICO-19; FLoRes-200; Tatoeba,N/A,N/A,N/A,N/A,N/A
Translation por-spa,3,TICO-19; FLoRes-200; Tatoeba,N/A,N/A,N/A,N/A,N/A
Translation dan-spa,3,FLoRes-101; FLoRes-200; Tatoeba,N/A,N/A,N/A,N/A,N/A
Translation ara-fra,3,TICO-19; FLoRes-101; Tatoeba,N/A,N/A,N/A,N/A,N/A
Translation heb-fra,3,FLoRes-101; FLoRes-200; Tatoeba,N/A,N/A,N/A,N/A,N/A
Translation heb-por,3,FLoRes-101; FLoRes-200; Tatoeba,N/A,N/A,N/A,N/A,N/A
Translation afr-spa,3,FLoRes-101; FLoRes-200; Tatoeba,N/A,N/A,N/A,N/A,N/A
Translation ceb-eng,3,FLoRes-101; FLoRes-200; Tatoeba,N/A,N/A,N/A,N/A,N/A
Translation ces-spa,3,FLoRes-101; FLoRes-200; Tatoeba,N/A,N/A,N/A,N/A,N/A
Translation hin-eng,3,FLoRes-101; FLoRes-200; Tatoeba,N/A,N/A,N/A,N/A,N/A
Translation hun-deu,3,FLoRes-101; FLoRes-200; Tatoeba,N/A,N/A,N/A,N/A,N/A
Translation hun-fra,3,FLoRes-101; FLoRes-200; Tatoeba,N/A,N/A,N/A,N/A,N/A
Translation hun-por,3,FLoRes-101; FLoRes-200; Tatoeba,N/A,N/A,N/A,N/A,N/A
Translation ind-deu,3,FLoRes-101; FLoRes-200; Tatoeba,N/A,N/A,N/A,N/A,N/A
Translation ind-eng,3,TICO-19; FLoRes-200; Tatoeba,N/A,N/A,N/A,N/A,N/A
Translation ind-fra,3,TICO-19; FLoRes-200; Tatoeba,N/A,N/A,N/A,N/A,N/A
Translation mar-eng,3,TICO-19; FLoRes-200; Tatoeba,N/A,N/A,N/A,N/A,N/A
Arabic Text Diacritization,3,CATT; WikiNews Dataset; Arabic Text Diacritization,CATT; Tashkeela,Diacritic Error Rate; DER(%); Word Error Rate (WER); WER (%),N/A,Speech; Natural Language Processing,Addition of diacritics for undiacritized arabic texts for words disambiguation.
Font Generation,3,Book Cover Dataset; Dafonts Free; CCSE,N/A,N/A,N/A,N/A,N/A
automatic-speech-translation,3,FLEURS; MediBeng; CoVoST,N/A,N/A,N/A,N/A,N/A
coreference-resolution,3,OntoNotes 5.0; DaNE; WinoPron,N/A,N/A,N/A,N/A,N/A
Contextual Embedding for Source Code,3,Spectre-v1; ETH Py150 Open; PyTorrent,N/A,N/A,N/A,Computer Code,N/A
Document Embedding,3,DAPFAM; unarXive; French CASS dataset,N/A,N/A,N/A,N/A,N/A
Short-Text Conversation,3,LCCC; VMD; ThreatGram 101 - Extreme Telegram Data,N/A,N/A,N/A,N/A,N/A
Food recommendation,3,Water Footprint Recommender System Data; Oktoberfest Food Dataset; Indian Food Image Dataset,Oktoberfest Food Dataset,10 fold Cross validation,N/A,Miscellaneous,N/A
Knowledge Base Population,3,Perlex; FarsBase-KBP; LM-KBC 2023,LM-KBC 2023,F1,N/A,Knowledge Base; Natural Language Processing,Knowledge base population is the task of filling the incomplete elements of a given knowledge base by automatically processing a large corpus of text.
Zero-shot Slot Filling,3,MASSIVE; T-REx; KAMEL,N/A,N/A,N/A,N/A,N/A
Session-Based Recommendations,3,OTTO Recommender Systems Dataset; Gowalla; Retailrocket,N/A,N/A,N/A,N/A,N/A
Cross Document Coreference Resolution,3,CoreSearch; WEC-Eng; SciCo,N/A,N/A,N/A,N/A,N/A
Intent Classification and Slot Filling,3,diaforge-utc-r-0725; ATIS (vi); MASSIVE,N/A,N/A,N/A,N/A,N/A
Facial Makeup Transfer,3,BeautyFace; CPM-Synt-2; CPM-Synt-1,N/A,N/A,N/A,N/A,N/A
Text to Speech,3,Gun Detection Dataset; ArVoice; OpenSLR,N/A,N/A,N/A,N/A,N/A
Document Translation,3,IWSLT2015; CodeXGLUE; WMT 2020,N/A,N/A,N/A,N/A,N/A
Long-Form Narrative Summarization,3,BookSum; MENSA; SummScreen,N/A,N/A,N/A,N/A,N/A
Translation hin-fra,3,TICO-19; FLoRes-101; FLoRes-200,N/A,N/A,N/A,N/A,N/A
Music Style Transfer,3,Niko Chord Progression Dataset; JS Fake Chorales; EMOPIA,N/A,N/A,N/A,N/A,N/A
Probing Language Models,3,BEAR-probe; BioLAMA; KAMEL,KAMEL,Average F1,N/A,Natural Language Processing,N/A
Word Similarity,3,WS353; Bangla Word Analogy; AnlamVer,WS353,Spearman's Rho,N/A,Natural Language Processing,Calculate a numerical score for the semantic similarity between two words.
ContextNER,3,SourceData-NLP; The EMBO SourceData-NLP dataset; EDGAR10-Q Dataset,N/A,N/A,N/A,N/A,N/A
Multi-modal Dialogue Generation,3,MMChat; OpenViDial 2.0; MMDialog,N/A,N/A,N/A,N/A,N/A
Natural Language Queries,3,YouwikiHow; ViLCo; Ego4D,Ego4D,R@1 Mean(0.3 and 0.5); R@1 IoU=0.5; R@1 IoU=0.3; R@5 IoU=0.3; R@5 IoU=0.5,Text-to-CQL,Natural Language Processing,N/A
Land Cover Classification,3,SPADA Dataset; CEMS-W; DeepGlobe,N/A,N/A,N/A,N/A,N/A
Text-based de novo Molecule Generation,3,ChEBI-20; L+M-24; TOMG-Bench,ChEBI-20,Text2Mol; Parameter Count; BLEU; MACCS FTS; Morgan FTS; Exact Match; Frechet ChemNet Distance (FCD); RDK FTS; Levenshtein; Validity,N/A,Medical,"Text-based de novo molecule generation involves utilizing natural language processing (NLP) techniques and chemical information to generate entirely new molecular structures. In this approach, molecul..."
Formal Logic,3,Mindgames; BIG-bench; probability_words_nli,N/A,N/A,N/A,N/A,N/A
text similarity,3,DICE: a Dataset of Italian Crime Event news; Phrase-in-Context; PubMed Cognitive Control Abstracts,N/A,N/A,N/A,N/A,N/A
Lemmatization,3,AMALGUM; GUM; Szeged Corpus,N/A,N/A,N/A,Natural Language Processing,**Lemmatization** is a process of determining a base or dictionary form (lemma) for a given surface form. Especially for languages with rich morphology it is important to be able to normalize words in...
Word Translation,3,satp-zsm-stage2; Soundscape Attributes Translation Project (SATP) Dataset; satp-zsm-stage1,N/A,N/A,N/A,Natural Language Processing,N/A
Data Summarization,3,PJM(AEP); M3LS; MentSum,N/A,N/A,N/A,Miscellaneous,"**Data Summarization** is a central problem in the area of machine learning, where we want to compute a small summary of the data.   <span class=""description-source"">Source: [How to Solve Fair k-Cente..."
Text Pair Classification,3,CRED; DACCORD; MTEB,N/A,N/A,N/A,N/A,N/A
Document Shadow Removal,3,Kligler; Jung; SD7K,N/A,N/A,N/A,N/A,N/A
Sentence-Pair Classification,3,GQNLI-FR; RTE3-FR; DACCORD,N/A,N/A,N/A,Natural Language Processing,N/A
Music Question Answering,3,MuChoMusic; MusicQA; MMVP,MusicQA,ROUGE; METEOR; BLEU; BERT Score,N/A,Music,N/A
Commonsense Causal Reasoning,3,CausalChaos!; COLD: Causal Reasoning in Closed Daily Activities; This is not a Dataset,N/A,N/A,N/A,Natural Language Processing,"""Commonsense Causal Reasoning is the process of capturing and understanding the causal dependencies amongst events and actions."" Luo, Zhiyi, et al. ""Commonsense causal reasoning between short texts."" ..."
knowledge editing,3,HalluEditBench; WikiFactDiff; KnowEdit,N/A,N/A,N/A,N/A,N/A
Multi-modal Recommendation,3,Amazon Baby; Amazon Sports; Amazon Clothing,N/A,N/A,N/A,N/A,N/A
TruthfulQA,3,GenAIPABench-Dataset; News; Knowledge,N/A,N/A,N/A,Knowledge Base,N/A
Informal-to-formal Style Transfer,3,ProofNetVerif; RLM25; ProofNet#,N/A,N/A,N/A,N/A,N/A
Facial Expression Translation,2,MH-FED; CelebA,N/A,N/A,N/A,N/A,N/A
Point Cloud Generation,2,ShapeNet; JetClass,ShapeNet Chair; ShapeNet; ShapeNet Car; ShapeNet Airplane,1-NNA-EMD; MMD-CD; 1-NNA-CD; EMD; CD,Point Cloud Completion,Computer Vision,N/A
NR-IQA,2,LIVE; UHD-IQA,N/A,N/A,N/A,N/A,N/A
Zero-shot Relation Classification,2,Wiki-ZSL; FewRel,N/A,N/A,N/A,N/A,N/A
Passage Re-Ranking,2,MS MARCO; mMARCO,TREC-PM; MS MARCO,mAP; MRR,N/A,Natural Language Processing,Passage re-ranking is the task of scoring and re-ranking a collection of retrieved documents based on an input query.
Chinese Sentence Pair Classification,2,XNLI; LCQMC,N/A,N/A,N/A,N/A,N/A
Cross-Lingual Natural Language Inference,2,XNLI; XGLUE,N/A,N/A,N/A,N/A,N/A
Linear-Probe Classification,2,SentEval; ADNI,N/A,N/A,N/A,N/A,N/A
Environment Sound Classification,2,UrbanSound8K; ESC-50,N/A,N/A,N/A,N/A,N/A
Short Text Clustering,2,AG News; MNAD,N/A,N/A,N/A,N/A,N/A
Semi-Supervised Text Classification,2,AG News; HeriGraph,N/A,N/A,N/A,N/A,N/A
One-shot Unsupervised Domain Adaptation,2,SYNTHIA; GTA5,N/A,N/A,N/A,N/A,N/A
Explainable Recommendation,2,Tripadvisor Restaurant Reviews; MovieLens,N/A,N/A,N/A,N/A,N/A
Movie Recommendation,2,MovieLens; Genre2Movies,N/A,N/A,N/A,N/A,N/A
Multi-label zero-shot learning,2,Open Images V4; NUS-WIDE,N/A,N/A,N/A,N/A,N/A
