Task Name,Dataset Count,Common Datasets (Top 10),Benchmarks,SOTA Metrics,Subtasks,Categories,Description (First 200 chars)
Question Answering,416,NExT-QA (Open-ended VideoQA); CNN/Daily Mail; Molweni; PersianQA; OpenBookQA; Researchy Questions; ReviewQA; SchizzoSQUAD; PhysiCo; WikiHop,NExT-QA (Open-ended VideoQA); DROP Test; MuLD (NarrativeQA); MedQA; SIQA; MRQA; CODAH; Molweni; OpenBookQA; SchizzoSQUAD,Operations per network pass; 1-of-100 Accuracy; BLEU-1; Conditional (w/ conditions); Overall; Exact Match (EM); Mean Error Rate; Exact F1; HEQQ; Accuracy (trained on 1k),Question Quality Assessment; Logical Reasoning Question Answering; Open-Domain Question Answering; Knowledge Base Question Answering; Generative Question Answering,Reasoning; Miscellaneous; Natural Language Processing,Question answering can be segmented into domain-specific tasks like community question answering and knowledge-base question answering. Popular benchmark datasets for evaluation question answering sys...
Classification,222,Urban Hyperspectral Image; Satellite; Open Radar Datasets; GRAZPEDWRI-DX; LLeQA; UK Biobank Brain MRI; GLUE; Two Coiling Spirals; Tasksource; Mudestreda,RTE; Radar Dataset (DIAT-μRadHAR: Radar micro-Doppler Signature dataset for Human Suspicious Activity Recognition); MixedWM38; N-ImageNet; Chest X-Ray Images (Pneumonia); MHIST; SGD; HOWS long; Coordinated Reply Attacks in Influence Operations: Characterization and Detection; CWRU Bearing Dataset,"Params (M); Robustness Score; macro f1 score (A(100), B(100), C(100) Avg.); MCC; 1-of-100 Accuracy; Macro F1; Detection AUROC (severity 5); Detection AUROC (severity 0); Overall accuracy after last sequence; 10 fold Cross validation",tercile classification; Classifier calibration; Clinical Section Identification; Underwater Acoustic Classification; quantum circuit classification (classical ML),Reasoning; Methodology; Computer Code; Time Series; Adversarial; Computer Vision; Audio; Miscellaneous; Medical; Graphs; Natural Language Processing,"**Classification** is the task of categorizing a set of data into predefined classes or groups. The aim of classification is to train a model to correctly predict the class or group of new, unseen dat..."
Text Classification,167,HateXplain; MetaHate; Avicenna: Deductive Commonsense Reasoning; MNAD; Overruling; LLeQA; MuMiN-medium; Twitter Sentiment Analysis; GLUE; Persian NLP Hub,HateXplain; Overruling; Twitter Sentiment Analysis; GLUE; reuters21578; NICE-45; RCV1; OneStopEnglish (Readability Assessment); 20 Newsgroups; IMDb,Average F1; Macro F1; Micro F1; weighted-F1 score; F1 Macro; STOPS-2; AUC; nDCG@3; macro F1; Weighted F1,Document Classification; Unsupervised Text Classification; Sentence Classification; Toxic Comment Classification; Satire Detection,Natural Language Processing,**Text Classification** is the task of assigning a sentence or document an appropriate category. The categories depend on the chosen dataset and can range from topics.     Text Classification problems...
Language Modelling,166,WMT 2018 News; SLNET; CLOTH; LRA; SIQA; RWC; Glot500-c; PolyNews; Libri-Light; SMC Text Corpus,Text8 dev; PhilPapers; 100 sleep nights of 8 caregivers; FewCLUE (BUSTM); BIG-bench-lite; CLUE (WSC1.1); FewCLUE (OCNLI-FC); OpenWebText; CLUE (DRCD); OpenWebtext2,PPL; 0..5sec; Bits per byte; parameters; Number of params; BPB; Gender Consistency; 10%; Sentiment Alignment; Room Consistency,Cross-Document Language Modeling; Sentence Pair Modeling; XLM-R; Controllable Language Modelling; Long-range modeling,Miscellaneous; Medical; Natural Language Processing,"A language model is a model of natural language. Language models are useful for a variety of tasks, including speech recognition, machine translation, natural language generation (generating more huma..."
Text Generation,162,Avicenna: Deductive Commonsense Reasoning; CNN/Daily Mail; needadvice; Reglamento_Aeronautico_Colombiano_2024; AAVE/SAE Paired Dataset; PolyNews; GLUE; ReDial; TaoDescribe; UHGEvalDataset,CNN/Daily Mail; LDC2016E25; CrimeStats; ReDial; Winogrande TR; Unruly; OpenBookQA; ARC Challenge (25-Shot); Open-Mindedness (0-shot); OpenWebText,BLEU-5; NLLgen; BLEU-1; JS-4; BLEU-2; Distinct-4; NLL; eval_loss; CIDEr; BLEU-4,Concept-To-Text Generation; Paper generation; Paraphrase Generation; Data-to-Text Generation; News Generation,Speech; Adversarial; Computer Code; Natural Language Processing,"**Text Generation** is the task of generating text with the goal of appearing indistinguishable to human-written text. This task is more formally known as ""natural language generation"" in the literatu..."
Sentiment Analysis,105,DSC (10 tasks); MultiSenti; ReDial; L3CubeMahaSent; ReviewQA; ASTD; SentNoB; Twitter US Airline Sentiment; NoReC; SentimentArcs: Sentiment Reference Corpus for Novels,ChnSentiCorp; IMDb Movie Reviews; FiQA; SLUE; IITP Movie Reviews Sentiment; 122 People - Passenger Behavior Recognition Data; TweetEval; RuSentiment; BanglaBook; Amazon Polarity,Yelp 2014 (Acc); Kitchen; Average F1; Training Time; Recall (%)	; Macro F1; IMDB (Acc); F1 Macro; 10 fold Cross validation; Average,Arabic Sentiment Analysis; Aspect Term Extraction and Sentiment Classification; target-oriented opinion words extraction; Pcl Detection; Aspect-Based Sentiment Analysis (ABSA),Computer Vision; Natural Language Processing,"**Sentiment Analysis** is the task of classifying the polarity of a given text. For instance, a text-based tweet can be categorized into either ""positive"", ""negative"", or ""neutral"". Given the text and..."
Text Summarization,98,CNN/Daily Mail; AUTH at BioLaySumm 2024: Bringing Scientific Content to Kids; UKIL-DB-EN; Multi-News; PerKey; Proto Summ; BrWac2Wiki; pn-summary; TQBA++; BookSum,BBC XSum; WikiHow; GigaWord; MeQSum; DUC 2004 Task 1; OrangeSum; GigaWord-10k; CL-SciSumm; LCSTS; ACI-Bench,Meteor; Rouge-2; Spearman Correlation; ROUGE-1; BLEU; ROUGE-3; BertScoreF1; BertScore; Avg. Test Rouge1; Rouge-1,Opinion Summarization; Sentence Summarization; Document Summarization; Abstractive Text Summarization; Long-Form Narrative Summarization,Knowledge Base; Natural Language Processing,"**Text Summarization** is a natural language processing (NLP) task that involves condensing a lengthy text document into a shorter, more compact version while still retaining the most important inform..."
Domain Adaptation,96,DAPlankton; Stanceosaurus; Five-Billion-Pixels; VisDA-2017; bladderbatch; VIDIT; KdConv; Adaptiope; Nikon RAW Low Light; Modern Office-31,HMDBfull-to-UCF; LeukemiaAttri; GTA-to-FoggyCityscapes; Sim10k; Noisy-SYND-to-MNIST; GTAV+Synscapes to Cityscapes; MoLane; GTAV to Cityscapes+Mapillary; UCF-to-Olympic; SYNTHIA-to-FoggyCityscapes,Accuracy (%);  mAP; mAP; mPQ; Average Accuracy; PSNR; Classification Accuracy; Lane Accuracy (LA); Extra Manual Annotation; Accuracy,Partial Domain Adaptation; Test-time Adaptation; Wildly Unsupervised Domain Adaptation; Open-Set Multi-Target Domain Adaptation; Unsupervised Domain Adaptation,Methodology; Computer Vision,**Domain Adaptation** is the task of adapting models across domains. This is motivated by the challenge where the test and training datasets fall from different data distributions due to some factor. ...
Reading Comprehension,95,WikiReading Recycled; CLOTH; NEREL-BIO; MRQA; Molweni; NomBank; PersianQA; PolicyQA; QuAC; CMRC,ReCAM; RACE; MuSeRC; RadQA; AdversarialQA; ReClor; CrowdSource QA,Accuracy (High); Accuracy (Middle); D(RoBERTa): F1; Average F1; EM ; D(BERT): F1; MSE; Accuracy; Answer F1; Test,Belebele; RACE-h; Figure Of Speech Detection; GRE Reading Comprehension; RACE-m,Natural Language Processing,Most current question answering datasets frame the task as reading comprehension where the question is about a paragraph or document and the answer often is a span in the document.     Some specific t...
Machine Translation,83,WMT 2018 News; Shifts; WMT 2018; MLQE-PE; BWB; MLQA; ContraCAT; Bilingual Corpus of Arabic-English Parallel Tweets; IWSLT2015; Hindi Visual Genome,Business Scene Dialogue EN-JA; IWSLT2015 English-Vietnamese; IWSLT2015 German-English; WMT 2018 English-Finnish; IWSLT2017 French-English; WMT 2022 English-Russian; WMT 2022 Czech-English; WMT2017 Finnish-English; WMT 2017 Latvian-English; WMT 2018 English-Estonian,ChrF++; Operations per network pass; 1-of-100 Accuracy; Hardware Burden; Number of Params; BLEU (Scn-En); Median Relative Edit Distance; SacreBLEU; BLEU (It-Scn); BLEURT,Transliteration; Bilingual Lexicon Induction; Automatic Post-Editing; Legal Document Translation; Multimodal Machine Translation,Natural Language Processing,**Machine translation** is the task of translating a sentence in a source language to a different target language.    Approaches for machine translation can range from rule-based to statistical to neu...
Natural Language Inference,81,GLUE; Tasksource; ContractNLI; NLI4Wills Corpus; WinoGrande; PAWS; SelQA; HeadQA; Story Commonsense; Mindgames,AX; RTE; MultiNLI; ANLI test; fever-nli; MedNLI; MNLI + SNLI + ANLI + FEVER; QNLI; GLUE; MultiNLI Dev,Params (M); Average F1; Macro F1; % Test Accuracy; % Dev Accuracy; A3; Dev Matched; Matched; A2; BLEU,Visual Entailment; Cross-Lingual Natural Language Inference; Answer Generation,Reasoning; Natural Language Processing,"**Natural language inference (NLI)** is the task of determining whether a ""hypothesis"" is   true (entailment), false (contradiction), or undetermined (neutral) given a ""premise"".    Example:    | Prem..."
Node Classification,76,Citeseer; Wisconsin (48%/32%/20% fixed splits); tolokers; MUTAG; MuMiN-medium; PASCAL VOC; Penn94; MuMiN-large; HeriGraph; USA Air-Traffic,MuMiN-medium; pokec; Coauthor CS; DBLP: 20 nodes per class; London; Telegram (Directed Graph label rate 60%); Wiki-Vote; Amazon Photo; Wisconsin; ogbn-products: 20 nodes per class,Macro F1; Micro F1; runtime (s); Training Split; Macro-F1@2%; Top-1 accuracy; Inference Time (ms); AUC; Average Top-1 Accuracy; macro F1,Graph structure learning; Heterogeneous Node Classification; Atomic number classification; Dynamic Node Classification; Node Classification on Non-Homophilic (Heterophilic) Graphs,Graphs,"**Node Classification** is a machine learning task in graph-based data analysis, where the goal is to assign labels to nodes in a graph based on the properties of nodes and the relationships between t..."
Natural Language Understanding,72,Belebele; NLU Evaluation Corpora; MeDAL; WikiCREM; EPIE; IndirectRequests; ChatLog; Perspectrum; GLUE; SGD,DialoGLUE full; LexGLUE; GLUE; STREUSLE; PDP60; DialoGLUE fewshot,CLINC150 (Acc); UNFAIR-ToS; Tags (Full) Acc; Full F1 (Preps); LEDGAR; ECtHR Task B; Average; ECtHR Task A; CaseHOLD; Role F1 (Preps),Emotional Dialogue Acts; Vietnamese Social Media Text Processing,Natural Language Processing,"**Natural Language Understanding** is an important field of Natural Language Processing which contains various tasks such as text classification, natural language inference and story comprehension. Ap..."
Code Generation,70,DSEval-Exercise; DSEval-Kaggle; Flat Real World Simulink Models; HumanEval-ET; TACO-BAAI; WebApp1K-React; BioCoder; BigCodeBench; TFix's Code Patches Data; CoNaLa-Ext,BigCodeBench-Instruct; HumanEval-ET; Multi-Source Python Code Corpus; TACO-BAAI; WebApp1K-React; CoNaLa-Ext; PECC; Android Repos; Django; MBPP-ET,Competition Pass@5; Test Set pass@5; Interview Pass@any; CorrSc; Java/BLEU; Competition Pass@any; Java/CodeBLEU; Introductory Pass@any; BLEU Score; Introductory Pass@1,Library-Oriented Code Generation; Class-level Code Generation; GitHub issue resolution; Code Translation; Code Documentation Generation,Reasoning; Computer Code; Natural Language Processing,"**Code Generation** is an important field to predict explicit code or program structure from multimodal data sources such as incomplete code, programs in another programming language, natural language..."
Common Sense Reasoning,56,CREAK; RWSD; Housekeep; ACCORD CSQA 0-5; StepGame; ReCoRD; X-CSQA; CODAH; PARus; QuRe,RWSD; ReCoRD; CODAH; PARus; Russian Event2Mind; Visual Dialog v0.9; Event2Mind test; WinoGrande; ARC (Challenge); BIG-bench (Sports Understanding),EM; Recall@10; EM ; BLEU; Jaccard Index; Dev; Average F1; F1; MSE; 1 in 10 R@5,Discourse Marker Prediction; Crash Blossom; Riddle Sense; Disambiguation QA; Crass AI,Reasoning; Natural Language Processing,"Common sense reasoning tasks are intended to require the model to go beyond pattern  recognition. Instead, the model should use ""common sense"" or world knowledge to make inferences."
Recommendation Systems,56,Spotify Podcast; Tripadvisor Restaurant Reviews; Gowalla; WyzeRule; Yelp2018; Wikidata-14M; CAL10K; Amazon Review; SweetRS; ReDial,Douban Monti; Gowalla; Amazon Games; MovieLens 10M; Yelp2018; Amazon-Movies; Amazon Books; ReDial; Flixster; Amazon Men,nDCG@10 (100 Neg. Samples); Recall@50; RMSE; HR@10 (full corpus); MAP@20; MAP@30; Hits@20; P@10; MAE; Hit@10,Session-Based Recommendations; Graph Neural Network; Multi-modal Recommendation; Multibehavior Recommendation; Knowledge-Aware Recommendation,Miscellaneous; Knowledge Base; Graphs,"### **Recommendation System in AI Research**      A **Recommendation System** is a specialized AI-driven model that analyzes user preferences and behaviors to suggest relevant content, products, or se..."
Graph Classification,54,Citeseer; BA-2motifs; MUTAG; IMDB-BINARY; CSL; UK Biobank Brain MRI; SIDER; OASIS; Mutagenicity; SPOT-10,Citeseer; IPC-grounded; NC1; HIV-fMRI-77; IMDB-BINARY; MUTAG; MalNet-Tiny; MSRC-21 (per-class); UK Biobank Brain MRI; CSL,Accuracy (%); Accuracy(10-fold); Rand index; Accuracy (10-fold); AP; ROC-AUC; F1; Accuracy; Mean Accuracy; Test Accuracy,Space group classification; Isomorphism Testing; Crystal system classification,Graphs,**Graph Classification** is a task that involves classifying a graph-structured data into different classes or categories. Graphs are a powerful way to represent relationships and interactions between...
Word Embeddings,53,WinoBias; United Nations Parallel Corpus; Interpretable STS; DICE: a Dataset of Italian Crime Event news; McQueen; RiskData; Twitter Death Hoaxes; SEND; pioNER; MUSE,N/A,N/A,Contextualised Word Representations; Multilingual Word Embeddings; Learning Word Embeddings; Embeddings Evaluation,Methodology; Natural Language Processing,Word embedding is the collective name for a set of language modeling and feature learning techniques in natural language processing (NLP) where words or phrases from the vocabulary are mapped to vecto...
Knowledge Graphs,46,DBP15K; CompMix-IR; ForecastQA; FB1.5M; AISECKG; Event-QA; ReDial; ORKG-QA; Kinship; ENT-DESC,MARS (Multimodal Analogical Reasoning dataSet);  FB15k; JerichoWorld; WikiKG90M-LSC,Validation MRR; MRR; Set accuracy; Test MRR,Person-Centric Knowledge Graphs; Knowledge Graph Completion; Complex Query Answering; Relational Pattern Learning; Open Knowledge Graph Canonicalization,Knowledge Base; Graphs,A knowledge graph is a structured representation of information that organizes data into nodes (entities) and edges (relationships) to show how different pieces of knowledge are interconnected. It ena...
Few-Shot Learning,45,CareCall; MedNLI; GLUE; CUB-200-2011; EuroSAT; MR; F-SIOL-310; FLEURS; SST-2; Bongard-OpenWorld,Mini-ImageNet - 20-Shot Learning; Mini-Imagenet 5-way (1-shot); MedNLI; OxfordPets; EuroSAT; MR; food101; UCF101; Mini-ImageNet - 1-Shot Learning; CaseHOLD,Macro Recall; 16-shot Accuracy; Micro Precision; Specificity; 12-shot Accuracy; F1-score; 5 way 1~2 shot; Macro F1; 4-shot Accuracy; AUC-ROC,Few-Shot Imitation Learning; Few-Shot Video Object Detection; few-shot-htc; Unsupervised Few-Shot Audio Classification; Few-Shot Audio Classification,Methodology; Computer Vision; Audio; Natural Language Processing,"**Few-Shot Learning** is an example of meta-learning, where a learner is trained on several related tasks, during the meta-training phase, so that it can generalize well to unseen (but related) tasks ..."
Coreference Resolution,45,WinoBias; Quizbowl; MASC; WikiCREM; OntoNotes 5.0; MultiReQA; LitBank; A Game Of Sorts; CoNLL; WSC,STM-coref; Quizbowl; WikiCoref; GAP; CoNLL12; XWinograd EN; DocRED-IE; The ARRAU Corpus; CoNLL 2012; Winograd Schema Challenge,Masculine F1 (M); MUC; Bias (F/M); Average F1; CoNLL F1; Avg. F1; F1; Accuracy; Overall F1; Avg F1,coreference-resolution; Cross Document Coreference Resolution,Natural Language Processing,Coreference resolution is the task of clustering mentions in text that refer to the same underlying real world entities.  Example:  ```                +-----------+                |           | I vote...
Audio Classification,43,Multimodal PISA; MediBeng; DiCOVA; Mudestreda; EPIC-KITCHENS-100; ReefSet; YouTube-100M; UrbanSound8K; DEEP-VOICE: DeepFake Voice Recognition; MeerKAT: Meerkat Kalahari Audio Transcripts,Multimodal PISA; DiCOVA; EPIC-KITCHENS-100; MeerKAT: Meerkat Kalahari Audio Transcripts; DEEP-VOICE: DeepFake Voice Recognition; EPIC-SOUNDS; ICBHI Respiratory Sound Database; GTZAN; Common Voice 16.1; MNIST,Test mAP; Accuracy (10-fold); Percentage correct; Mean AP; d-prime; Top-1 Noun; AUC; Top 1 Accuracy; MosquitoSound; ICBHI Score,Audio Multiple Target Classification; Parkinson Detection from Speech; Semi-supervised Audio Classification; Environmental Sound Classification,Audio,**Audio Classification** is a machine learning task that involves identifying and tagging audio signals into different classes or categories. The goal of audio classification is to enable machines to ...
Zero-Shot Learning,43,How2QA; TVQA+; TVQA; COCO-MLT; AwA2; CUB-200-2011; VOC-MLT; EuroSAT; UCF101; ImageNet_CN,How2QA; TVQA; COCO-MLT; AwA2; CUB-200-2011; VOC-MLT; EuroSAT; ImageNet_CN; UCF101; Oxford-IIIT Pets,k=10 mIOU; A-acc; Top 1 Accuracy; Average mAP; average top-1 classification accuracy; Pearson correlation coefficient (PCC); Accuracy Unseen; Accuracy; Accuracy Seen; H,Compositional Zero-Shot Learning; Transductive Zero-Shot Classification; Generalized Zero-Shot Learning; Temporal Action Localization; GZSL Video Classification,Methodology; Computer Vision,**Zero-shot learning (ZSL)** is a model's ability to detect classes never seen during training. The condition is that the classes are not known during supervised learning.     Earlier work in zero-sho...
Machine Reading Comprehension,43,Belebele; CMRC 2018; DREAM; MC-AFP; WikiReading Recycled; NEREL-BIO; MRQA; ViMMRC; Molweni; Who-did-What,N/A,N/A,N/A,N/A,N/A
Unsupervised Domain Adaptation,34,nuScenes (Cross-City UDA); ImageNet-R; Market-1501; Sim10k; Oxford RobotCar Dataset; EPIC-KITCHENS-100; PACS; Five-Billion-Pixels; Sims4Action; MegaAge,Duke to Market; PreSIL to KITTI; ImageNet-R; GTAV-to-Cityscapes Labels; UCF-HMDB; VehicleID to VERI-Wild Medium; EPIC-KITCHENS-100; Veri-776 to VehicleID Medium; PACS; Duke to MSMT, mAP; mAP@0.5; R5; R-1; MIoU (16 classes); rank-5; AP@0.5; Market-1501->mAP; R10; mIoU (19 classes),Online unsupervised domain adaptation,N/A,**Unsupervised Domain Adaptation** is a learning framework to transfer knowledge learned from source domains with a large number of annotated training examples to target domains with unlabeled data on...
Dialogue Generation,34,CareCall; Arabic-ToD; JDDC 2.0; LLMafia; CPsyCounE; diaforge-utc-r-0725; OpenDialKG; UDC; OpenViDial 2.0; SODA,Ubuntu Dialogue (Entity); Twitter Dialogue (Noun); FusedChat; Persona-Chat; CMU-DoG; Ubuntu Dialogue (Cmd); PG-19; Ubuntu Dialogue (Tense); Reddit (multi-ref); Amazon-5,PPL; Meteor; BLEU-1; Slot Accuracy; relevance (human); Joint SA; CIDr; Avg F1; Sensibleness; mauve,Multi-modal Dialogue Generation,Natural Language Processing,"Dialogue generation is the task of ""understanding"" natural language inputs - within natural language processing in order to produce output. The systems are usually intended for conversing with humans,..."
Music Generation,33,abc_cc; JS Fake Chorales; POP909; MusicCaps; MidiCaps; YM2413-MDB; EMOPIA; MuseData; Guitar-TECHS; NES-VMDB,Song Describer Dataset,FAD VGG,Music Performance Rendering; Multimodal Music Generation; Music Texture Transfer,Music; Audio,Musique guitar
Domain Generalization,31,ImageNet-R; NICO++; All-day CityScapes; PACS; Sims4Action; Cityscapes; ImageNet-Sketch; NICO; Stylized ImageNet; Wild-Time,"ImageNet-R; Stylized-ImageNet; NICO Vehicle; PACS; ImageNet-Sketch; ImageNet-A; NICO Animal; GTA-to-Avg(Cityscapes,BDD,Mapillary); VLCS; VizWiz-Classification",Accuracy - Corrupted Images; Average Accuracy; Top 1 Accuracy; Top-1 Error Rate; mean Corruption Error (mCE); Accuracy; Accuracy - All Images; Number of params; Mean IoU; Top-1 accuracy %,Single-Source Domain Generalization; Source-free Domain Generalization; Evolving Domain Generalization,Computer Vision,"The idea of **Domain Generalization** is to learn from one or multiple training domains, to extract a domain-agnostic model which can be applied to an unseen domain   <span class=""description-source"">..."
Multi-Label Classification,30,MIMIC-CXR; EXTREME CLASSIFICATION; CheXpert; OpenImages-v6; NLP Taxonomy Classification Data; MRNet; ECHR; PASCAL VOC 2007; CAVES; BanglaLekha-Isolated,ChestX-ray14; MRNet; MIMIC-CXR; PASCAL VOC 2007; MLRSNet; MS-COCO; PASCAL VOC 2012; CheXpert; OpenImages-v6; NUS-WIDE,AUC on Meniscus Tear (MEN); mAP; AUC on Abnormality (ABN); Accuracy on ACL Tear (ACL); F1-score; Average Accuracy; Average AUC; AUC on ACL Tear (ACL); AVERAGE AUC ON 14 LABEL; Macro F1,Hierarchical Multi-label Classification; Extreme Multi-Label Classification; Medical Code Prediction; Missing Labels,Reasoning; Medical; Methodology; Computer Vision,"**Multi-Label Classification** is the supervised learning problem where an instance may be associated with multiple labels. This is an extension of single-label classification (i.e., multi-class, or b..."
Slot Filling,28,Dialogue State Tracking Challenge; IndirectRequests; NoMusic; SGD; pioNER; xSID; MultiWOZ; diaforge-utc-r-0725; RiSAWOZ; CareerCoach 2022,Dialogue State Tracking Challenge; CAIS; KILT: Zero Shot RE; MASSIVE; MULTIWOZ 2.2; KILT: T-REx; MixATIS; MixSNIPS; ATIS; ATIS (vi),FITB; Recall@5; Slot F1 Score; KILT-AC; F1; KILT-F1; Slot F1; R-Prec; Micro F1; F1 (5-shot) avg,Extracting COVID-19 Events from Twitter; Zero-shot Slot Filling,Natural Language Processing,"The goal of **Slot Filling** is to identify from a running dialog different slots, which correspond to different parameters of the user’s query. For instance, when a user queries for nearby restaurant..."
Document Summarization,28,WikiSum; FINDSum; CNN/Daily Mail; HowSumm; Multi-XScience; NEWSROOM; TalkSumm; AESLC; OpoSum; Multi-News,BBC XSum; CNN / Daily Mail; WikiLingua (tr->en); Arxiv HEP-TH citation graph; arXiv Summarization Dataset; HowSumm-Method; HowSumm-Step,PPL; ROUGE-1; ROUGE-2; Rouge-L; Rouge-2; ROUGE-L,Email Thread Summarization,Natural Language Processing,Automatic **Document Summarization** is the task of rewriting a document into its shorter form while still retaining its important content. The most popular two paradigms are extractive approaches and...
NER,27,IECSIL FIRE-2018 Shared Task; InLegalNER; AISECKG; SIGARRA News Corpus; TLUnified-NER; FiNER-139; SourceData-NLP; BC4CHEMD; MSRA CN NER; Noise-SF,N/A,N/A,N/A,N/A,N/A
Part-Of-Speech Tagging,26,CoNLL 2017 Shared Task - Automatically Annotated Raw Texts and Word Embeddings; MASC; Twitter PoS VCB; Szeged Corpus; Egyptian Arabic Segmentation Dataset; Ritter PoS; Morphosyntactic-analysis-dataset; CoNLL; Finer; LinCE,ANTILLES; UD2.5 test; Sequoia Treebank; Spoken Corpus; Penn Treebank; ARK; Morphosyntactic-analysis-dataset; DaNE; Tweebank; ParTUT,Accuracy (%); Avg. F1; BLEX; Avg accuracy; UPOS; Accuracy; Acc; Weighted Average F1-score; Macro-averaged F1,Unsupervised Part-Of-Speech Tagging,Natural Language Processing,Part-of-speech tagging (POS tagging) is the task of tagging a word in a text with its part of speech.  A part of speech is a category of words with similar grammatical properties. Common English  part...
Open-Domain Question Answering,26,SQuAD; ARCD; WikiQAar; Natural Questions; InfoSeek; WikiMovies; LAMA; DuReader; ELI5; ScienceQA,KILT: ELI5; ELI5; KILT: TriviaQA; SQuAD1.1 dev; Quasar; Natural Questions (short); TQA; Natural Questions; SearchQA; WebQuestions,EM; Recall@5; F1; KILT-EM; KILT-F1; Exact Match; R-Prec; Rouge-L; N-gram F1; EM (Quasar-T),N/A,Natural Language Processing,Open-domain question answering is the task of question answering on open-domain datasets such as Wikipedia.
Mathematical Reasoning,26,Lila; PGPS9K; DART-Math-Uniform; TheoremQA; IconQA; ConstructiveBench; MathMC; MATH-V; PrOntoQA; Conic10K,Lila (IID); PGPS9K; MATH500; FrontierMath; AMC23; Lila (OOD); GSM8K; UniGeo; GeoQA; UniGeo (PRV),Accuracy (%); Accuracy; Completion accuracy; Acc,High School Mathematics; Formal Logic; Math Word Problem Solving; Abstract Algebra; Geometry Problem Solving,Reasoning; Knowledge Base; Natural Language Processing,N/A
Question Generation,25,SQuAD; 30MQA; Natural Questions; MMD; HybridQA; InfoLossQA; OK-VQA; diaforge-utc-r-0725; FreebaseQA; TextBox 2.0,GrailQA-IID; COCO Visual Question Answering (VQA) real images 1.0 open ended; GrailQA-Compositional; SQuAD; GrailQA-Zero-Shot; Natural Questions; FairytaleQA; Visual Question Generation; WeiboPolls; SQuAD1.1,BLEU-3; ROUGE-1; BLEU; R-QAE; QAE; BLEU-1; METEOR; bleu; FactSpotter; ROUGE-L,Poll Generation,Natural Language Processing,"The goal of **Question Generation** is to generate a valid and fluent question according to a given passage and the target answer. Question Generation can be used in many scenarios, such as automatic ..."
